{
  "id": "shopkeeper",
  "numeric_id": 3,
  "name_key": "people.archetype.shopkeeper",
  "age_range": [
    30,
    65
  ],
  "money_range": [
    30000,
    500000
  ],
  "walk_speed": 1.3,
  "courage": 0.6,
  "fights_back": 0.3,
  "schedule": [
    {
      "from": 0,
      "to": 7,
      "activity": "sleep",
      "place_category": "home"
    },
    {
      "from": 7,
      "to": 9,
      "activity": "home",
      "place_category": "home"
    },
    {
      "from": 9,
      "to": 21,
      "activity": "work",
      "place_category": "shop"
    },
    {
      "from": 21,
      "to": 22,
      "activity": "eat",
      "place_category": "eat"
    },
    {
      "from": 22,
      "to": 24,
      "activity": "home",
      "place_category": "home"
    }
  ],
  "reactions": {
    "fight": "call_police",
    "gunshot": "flee"
  },
  "line_keys": [
    "people.line.shopkeeper_shop_welcome",
    "people.line.shopkeeper_shop_slow_day"
  ]
}
