{
  "id": "student_adult",
  "numeric_id": 2,
  "name_key": "people.archetype.student_adult",
  "age_range": [
    19,
    26
  ],
  "money_range": [
    5000,
    60000
  ],
  "walk_speed": 1.6,
  "courage": 0.5,
  "fights_back": 0.15,
  "schedule": [
    {
      "from": 0,
      "to": 7,
      "activity": "sleep",
      "place_category": "home"
    },
    {
      "from": 7,
      "to": 9,
      "activity": "home",
      "place_category": "home"
    },
    {
      "from": 9,
      "to": 12,
      "activity": "work",
      "place_category": "campus"
    },
    {
      "from": 12,
      "to": 13,
      "activity": "eat",
      "place_category": "eat"
    },
    {
      "from": 13,
      "to": 17,
      "activity": "work",
      "place_category": "campus"
    },
    {
      "from": 17,
      "to": 19,
      "activity": "cafe",
      "place_category": "cafe"
    },
    {
      "from": 19,
      "to": 23,
      "activity": "walk",
      "place_category": "nightlife"
    },
    {
      "from": 23,
      "to": 24,
      "activity": "home",
      "place_category": "home"
    }
  ],
  "reactions": {
    "fight": "film",
    "gunshot": "flee"
  },
  "line_keys": [
    "people.line.student_adult_student_exam",
    "people.line.student_adult_student_money"
  ]
}
